{
  "$schema": "http://json-schema.org/draft-07/schema#",
  "$id": "https://dragonjar.org/schemas/android-pentesting/finding.schema.json",
  "title": "Android Pentesting Finding",
  "description": "Canonical DRY finding schema for grep, semgrep, RASP, Frida, MobSF, Burp, and manual findings in the Android Pentesting Skill",
  "type": "object",
  "required": ["title", "severity", "confidence", "cvss_4_0_score", "owasp_category", "cwe_id", "description", "source"],
  "properties": {
    "id": {
      "type": "string",
      "pattern": "^(FINDING|VULN)-\\d{3}$",
      "description": "Report ordinal ID, e.g. FINDING-001 or VULN-001. Assigned after deduplication; not part of the dedupe key."
    },
    "title": {
      "type": "string",
      "description": "Imperative finding title, e.g. 'Hardcoded API Key in Source Code'"
    },
    "severity": {
      "type": "string",
      "enum": ["Critical", "High", "Medium", "Low", "Informational"],
      "description": "CVSS-derived severity level"
    },
    "confidence": {
      "type": "string",
      "enum": ["Confirmed", "Likely", "Needs Dynamic Confirmation", "Informational", "Rejected", "High", "Medium", "Low"],
      "description": "Evidence confidence. Tools may emit High/Medium/Low; reports should normalize to Confirmed/Likely/Needs Dynamic Confirmation when possible."
    },
    "cvss_4_0_score": {
      "type": ["number", "string"],
      "description": "CVSS 4.0 score (0.0-10.0), optional vector string, or 'TBD' for Needs Dynamic Confirmation"
    },
    "cvss_score": {
      "type": ["number", "string"],
      "description": "Deprecated alias for cvss_4_0_score. Accept only for backward compatibility; new tools must emit cvss_4_0_score."
    },
    "cvss_vector": {
      "type": ["string", "null"],
      "description": "CVSS 4.0 vector string when available"
    },
    "owasp_category": {
      "type": "string",
      "pattern": "^M(0?[1-9]|10)-202[0-9]$",
      "description": "OWASP Mobile Top 10 category, e.g. M1-2024"
    },
    "cwe_id": {
      "type": "string",
      "pattern": "^CWE-\\d+$",
      "description": "CWE ID, e.g. CWE-798"
    },
    "masvs_control": {
      "type": "string",
      "description": "MASVS/MSTG control ID, e.g. MSTG-CRYPTO-1"
    },
    "description": {
      "type": "string",
      "description": "Detailed finding description"
    },
    "proof_of_concept": {
      "type": "string",
      "description": "Steps to reproduce or exploit the finding"
    },
    "evidence": {
      "type": "string",
      "description": "Relevant code/data snippet or runtime evidence"
    },
    "attack_scenario": {
      "type": "string",
      "description": "How an attacker would exploit the issue"
    },
    "remediation": {
      "type": "string",
      "description": "Recommended remediation steps"
    },
    "source": {
      "type": "string",
      "enum": ["grep", "semgrep", "rasp", "frida", "manual", "mobsf", "burp", "sandbox", "logcat", "diff", "firebase", "drozer", "adb"],
      "description": "Detection source tool: diff = APK version diffing, firebase = network check of Firebase exposure, drozer = IPC framework probes, adb = adb backup extraction"
    },
    "detector": {
      "type": "string",
      "description": "Detector or rule ID that generated the finding"
    },
    "triggered": {
      "type": "boolean",
      "description": "For RASP findings: whether the detector triggered"
    },
    "bypass_available": {
      "type": "boolean",
      "description": "For RASP findings: whether a validation/bypass profile is available"
    },
    "file": {
      "type": "string",
      "description": "Relative path within decoded APK or analyzed project"
    },
    "line": {
      "type": "integer",
      "description": "Line number when available"
    },
    "framework": {
      "type": "string",
      "description": "react-native, flutter, cordova, xamarin, dotnet-maui, unity, native, or unknown"
    },
    "phase": {
      "type": "string",
      "description": "Workflow phase that found this: 0, 1, 2, 2.5, 3, 4, or 5"
    }
  },
  "additionalProperties": true
}
